{
  "$schema": "https://json-schema.org/draft/2020-12/schema",
  "$id": "https://spec.finfocus.dev/schemas/plugin_manifest.schema.json",
  "title": "Plugin Manifest v0.1.0",
  "description": "Comprehensive plugin manifest schema for FinFocus plugin registration and management",
  "type": "object",
  "required": ["metadata", "specification", "installation"],
  "properties": {
    "metadata": {
      "type": "object",
      "required": ["name", "version", "description", "author"],
      "properties": {
        "name": {
          "type": "string",
          "pattern": "^[a-z0-9]([a-z0-9-]*[a-z0-9])?$",
          "minLength": 2,
          "maxLength": 50,
          "description": "Unique plugin identifier (lowercase, alphanumeric with hyphens)"
        },
        "version": {
          "type": "string",
          "pattern": "^(0|[1-9]\\d*)\\.(0|[1-9]\\d*)\\.(0|[1-9]\\d*)(?:-((?:0|[1-9]\\d*|\\d*[a-zA-Z-][0-9a-zA-Z-]*)(?:\\.(?:0|[1-9]\\d*|\\d*[a-zA-Z-][0-9a-zA-Z-]*))*))?(?:\\+([0-9a-zA-Z-]+(?:\\.[0-9a-zA-Z-]+)*))?$",
          "description": "Semantic version (e.g., '1.0.0', '2.1.0-beta.1')"
        },
        "description": {
          "type": "string",
          "minLength": 10,
          "maxLength": 500,
          "description": "Human-readable plugin description"
        },
        "author": {
          "type": "string",
          "minLength": 2,
          "maxLength": 100,
          "description": "Plugin author or organization name"
        },
        "homepage": {
          "type": "string",
          "format": "uri",
          "description": "Plugin homepage URL"
        },
        "repository": {
          "type": "string",
          "format": "uri",
          "description": "Source code repository URL"
        },
        "license": {
          "type": "string",
          "enum": [
            "Apache-2.0", "MIT", "BSD-2-Clause", "BSD-3-Clause", 
            "GPL-2.0", "GPL-3.0", "LGPL-2.1", "LGPL-3.0",
            "MPL-2.0", "ISC", "Unlicense", "PROPRIETARY"
          ],
          "description": "Plugin license identifier (SPDX format)"
        },
        "keywords": {
          "type": "array",
          "items": {
            "type": "string",
            "minLength": 2,
            "maxLength": 30,
            "pattern": "^[a-z0-9]+([a-z0-9-]*[a-z0-9])?$"
          },
          "maxItems": 10,
          "uniqueItems": true,
          "description": "Searchable keywords for plugin discovery"
        },
        "created_at": {
          "type": "string",
          "format": "date-time",
          "description": "Plugin creation timestamp (ISO 8601)"
        },
        "updated_at": {
          "type": "string",
          "format": "date-time",
          "description": "Plugin last updated timestamp (ISO 8601)"
        }
      },
      "additionalProperties": false
    },
    
    "specification": {
      "type": "object",
      "required": ["spec_version", "supported_providers", "service_definition"],
      "properties": {
        "spec_version": {
          "type": "string",
          "pattern": "^(0|[1-9]\\d*)\\.(0|[1-9]\\d*)\\.(0|[1-9]\\d*)$",
          "description": "FinFocus specification version supported (e.g., '0.1.0')"
        },
        "supported_providers": {
          "type": "array",
          "items": {
            "type": "string",
            "enum": ["aws", "azure", "gcp", "kubernetes", "custom"]
          },
          "minItems": 1,
          "maxItems": 5,
          "uniqueItems": true,
          "description": "Cloud providers supported by this plugin. Entries are clouds, not IaC packages: a plugin that prices azure-native resources lists azure."
        },
        "supported_resources": {
          "type": "object",
          "patternProperties": {
            "^(aws|azure|gcp|kubernetes|custom)$": {
              "type": "object",
              "properties": {
                "resource_types": {
                  "type": "array",
                  "items": {
                    "type": "string",
                    "minLength": 1,
                    "maxLength": 256
                  },
                  "minItems": 1,
                  "uniqueItems": true,
                  "description": "Supported resource types for this provider. Each entry is the resource type string the plugin matches against ResourceDescriptor.resource_type. The full type token is recommended (for example azure-native:compute:VirtualMachine or aws:ec2/instance:Instance). A native package's types are listed under their cloud, so azure-native types go under azure."
                },
                "billing_modes": {
                  "type": "array",
                  "items": {
                    "type": "string",
                    "enum": [
                      "per_hour", "per_minute", "per_second", 
                      "per_gb_month", "per_gb_hour", "per_gb_day",
                      "per_request", "per_operation", "per_transaction",
                      "per_execution", "per_invocation",
                      "flat", "per_day", "per_month", "per_year",
                      "per_cpu_hour", "per_cpu_month", "per_vcpu_hour",
                      "per_memory_gb_hour", "per_memory_gb_month",
                      "per_iops", "per_provisioned_iops",
                      "per_rcu", "per_wcu", "per_dtu", "per_ru",
                      "on_demand", "reserved", "spot", "preemptible",
                      "savings_plan", "committed_use", "hybrid_benefit",
                      "per_data_transfer_gb", "per_bandwidth_gb",
                      "per_api_call", "per_lookup", "per_query"
                    ]
                  },
                  "uniqueItems": true,
                  "description": "Supported billing modes for this provider"
                },
                "regions": {
                  "type": "array",
                  "items": {
                    "type": "string",
                    "minLength": 2,
                    "maxLength": 30
                  },
                  "uniqueItems": true,
                  "description": "Supported regions for this provider"
                }
              },
              "required": ["resource_types"],
              "additionalProperties": false
            }
          },
          "additionalProperties": false,
          "description": "Resource types supported per provider. Keys are clouds; a native package's resource types go under their cloud (azure-native types under azure)."
        },
        "capabilities": {
          "type": "array",
          "items": {
            "type": "string",
            "enum": [
              "cost_retrieval", "cost_projection", "pricing_specs",
              "historical_data", "real_time_data", "batch_processing",
              "rate_limiting", "caching", "encryption", "compression",
              "filtering", "aggregation", "multi_tenancy", "audit_logging",
              "projected_costs", "actual_costs", "carbon", "recommendations",
              "dry_run", "budgets", "energy", "water", "pricing_spec",
              "estimate_cost", "dismiss_recommendations", "batch_cost",
              "resolve_resource_types", "usage_stats", "allocation",
              "contract_commitments", "invoice_data", "recommendation_scoring"
            ]
          },
          "uniqueItems": true,
          "description": "Plugin capabilities. Accepts the manifest capability strings (cost_retrieval through audit_logging) and every PluginCapability value from enums.proto, written as the lowercase value name without the PLUGIN_CAPABILITY_ prefix (PLUGIN_CAPABILITY_DRY_RUN is dry_run)."
        },
        "service_definition": {
          "type": "object",
          "required": ["service_name", "package_name", "methods"],
          "properties": {
            "service_name": {
              "type": "string",
              "pattern": "^[A-Z][a-zA-Z0-9]*Service$",
              "description": "gRPC service name (e.g., 'CostSourceService')"
            },
            "package_name": {
              "type": "string",
              "pattern": "^[a-z][a-z0-9]*(\\.v[0-9]+)?$",
              "description": "Protobuf package name (e.g., 'finfocus.v1')"
            },
            "methods": {
              "type": "array",
              "items": {
                "type": "string",
                "enum": [
                  "Name", "Supports", "GetActualCost", "GetProjectedCost", "GetPricingSpec",
                  "EstimateCost", "GetRecommendations", "DismissRecommendation", "GetBudgets",
                  "GetPluginInfo", "DryRun", "BatchCost", "ResolveResourceTypes"
                ]
              },
              "minItems": 1,
              "uniqueItems": true,
              "description": "Implemented CostSourceService RPCs, by proto method name. RPCs of other services are discovered through capabilities."
            },
            "port": {
              "type": "integer",
              "minimum": 1024,
              "maximum": 65535,
              "default": 50051,
              "description": "Default service port"
            },
            "health_check_path": {
              "type": "string",
              "pattern": "^/[a-zA-Z0-9._/-]*$",
              "description": "Health check endpoint path"
            }
          },
          "additionalProperties": false
        },
        "observability_support": {
          "type": "object",
          "properties": {
            "metrics_enabled": {
              "type": "boolean",
              "default": false,
              "description": "Whether metrics collection is supported"
            },
            "tracing_enabled": {
              "type": "boolean",
              "default": false,
              "description": "Whether distributed tracing is supported"
            },
            "logging_enabled": {
              "type": "boolean",
              "default": true,
              "description": "Whether structured logging is supported"
            },
            "health_checks_enabled": {
              "type": "boolean",
              "default": true,
              "description": "Whether health checks are supported"
            },
            "sli_support": {
              "type": "boolean",
              "default": false,
              "description": "Whether SLI reporting is supported"
            }
          },
          "additionalProperties": false
        }
      },
      "additionalProperties": false
    },
    
    "security": {
      "type": "object",
      "properties": {
        "signature": {
          "type": "string",
          "pattern": "^[A-Za-z0-9+/]+=*$",
          "description": "Base64-encoded plugin signature for verification"
        },
        "public_key": {
          "type": "string",
          "description": "Public key for signature verification"
        },
        "certificate_chain": {
          "type": "array",
          "items": {
            "type": "string"
          },
          "description": "Certificate chain for verification"
        },
        "security_level": {
          "type": "string",
          "enum": ["untrusted", "community", "verified", "official"],
          "default": "untrusted",
          "description": "Plugin security trust level"
        },
        "permissions": {
          "type": "array",
          "items": {
            "type": "string",
            "enum": [
              "network_access", "filesystem_read", "filesystem_write",
              "environment_read", "process_spawn", "system_info",
              "temp_files", "config_read", "metrics_collect"
            ]
          },
          "uniqueItems": true,
          "description": "Required system permissions"
        },
        "sandbox_required": {
          "type": "boolean",
          "default": false,
          "description": "Whether sandboxing is required for this plugin"
        }
      },
      "additionalProperties": false
    },
    
    "installation": {
      "type": "object",
      "required": ["installation_method"],
      "properties": {
        "installation_method": {
          "type": "string",
          "enum": ["binary", "container", "script", "package"],
          "description": "How to install the plugin"
        },
        "download_url": {
          "type": "string",
          "format": "uri",
          "description": "Plugin download URL"
        },
        "checksum": {
          "type": "string",
          "pattern": "^[a-fA-F0-9]+$",
          "minLength": 32,
          "description": "File integrity checksum"
        },
        "checksum_algorithm": {
          "type": "string",
          "enum": ["sha256", "sha512", "md5"],
          "default": "sha256",
          "description": "Checksum algorithm used"
        },
        "install_script": {
          "type": "string",
          "description": "Installation script content or path"
        },
        "pre_install_checks": {
          "type": "array",
          "items": {
            "type": "string"
          },
          "description": "Checks to run before installation"
        },
        "post_install_steps": {
          "type": "array",
          "items": {
            "type": "string"
          },
          "description": "Steps to run after installation"
        }
      },
      "additionalProperties": false
    },
    
    "configuration": {
      "description": "Not the host delivery channel. Hosts read plugin settings from GetPluginInfoResponse.settings and inject each value under the advertised environment variable. The SDK does not read this object.",
      "type": "object",
      "properties": {
        "schema": {
          "type": "string",
          "description": "JSON schema for configuration validation"
        },
        "default_config": {
          "type": "string",
          "description": "Default configuration as JSON string"
        },
        "required_fields": {
          "type": "array",
          "items": {
            "type": "string"
          },
          "uniqueItems": true,
          "description": "Required configuration fields"
        },
        "examples": {
          "type": "array",
          "items": {
            "type": "object",
            "required": ["name", "description", "config"],
            "properties": {
              "name": {
                "type": "string",
                "minLength": 1,
                "maxLength": 50,
                "description": "Example name"
              },
              "description": {
                "type": "string",
                "minLength": 1,
                "maxLength": 200,
                "description": "Example description"
              },
              "config": {
                "type": "string",
                "description": "Example configuration as JSON string"
              }
            },
            "additionalProperties": false
          },
          "description": "Configuration examples"
        }
      },
      "additionalProperties": false
    },
    
    "requirements": {
      "type": "object",
      "properties": {
        "min_spec_version": {
          "type": "string",
          "pattern": "^(0|[1-9]\\d*)\\.(0|[1-9]\\d*)\\.(0|[1-9]\\d*)$",
          "description": "Minimum required FinFocus spec version"
        },
        "max_spec_version": {
          "type": "string",
          "pattern": "^(0|[1-9]\\d*)\\.(0|[1-9]\\d*)\\.(0|[1-9]\\d*)$",
          "description": "Maximum supported FinFocus spec version"
        },
        "dependencies": {
          "type": "array",
          "items": {
            "type": "object",
            "required": ["name", "version_constraint"],
            "properties": {
              "name": {
                "type": "string",
                "pattern": "^[a-z0-9]([a-z0-9-]*[a-z0-9])?$",
                "description": "Required plugin name"
              },
              "version_constraint": {
                "type": "string",
                "pattern": "^([><=!~^]*)([0-9]+\\.[0-9]+\\.[0-9]+)(.*)$",
                "description": "Version constraint (e.g., '>=1.0.0,<2.0.0')"
              },
              "optional": {
                "type": "boolean",
                "default": false,
                "description": "Whether dependency is optional"
              }
            },
            "additionalProperties": false
          },
          "description": "Plugin dependencies"
        },
        "system_requirements": {
          "type": "object",
          "properties": {
            "min_memory_mb": {
              "type": "integer",
              "minimum": 64,
              "maximum": 32768,
              "description": "Minimum memory requirement in MB"
            },
            "min_disk_mb": {
              "type": "integer",
              "minimum": 1,
              "maximum": 10240,
              "description": "Minimum disk space requirement in MB"
            },
            "supported_architectures": {
              "type": "array",
              "items": {
                "type": "string",
                "enum": ["x86_64", "arm64", "i386", "armv7", "ppc64le", "s390x"]
              },
              "uniqueItems": true,
              "minItems": 1,
              "description": "Supported CPU architectures"
            },
            "supported_os": {
              "type": "array",
              "items": {
                "type": "string",
                "enum": ["linux", "windows", "darwin", "freebsd", "openbsd", "netbsd"]
              },
              "uniqueItems": true,
              "minItems": 1,
              "description": "Supported operating systems"
            }
          },
          "additionalProperties": false
        },
        "runtime_requirements": {
          "type": "object",
          "properties": {
            "grpc_version": {
              "type": "string",
              "pattern": "^[0-9]+\\.[0-9]+\\.[0-9]+$",
              "description": "Required gRPC version"
            },
            "tls_required": {
              "type": "boolean",
              "default": true,
              "description": "Whether TLS is required"
            },
            "auth_methods": {
              "type": "array",
              "items": {
                "type": "string",
                "enum": ["none", "api_key", "jwt", "oauth2", "mtls", "basic_auth"]
              },
              "uniqueItems": true,
              "description": "Supported authentication methods"
            },
            "timeout_seconds": {
              "type": "integer",
              "minimum": 1,
              "maximum": 300,
              "default": 30,
              "description": "Plugin response timeout in seconds"
            }
          },
          "additionalProperties": false
        }
      },
      "additionalProperties": false
    }
  },
  "additionalProperties": false
}